,arg_id,LocalAcceptability,Cogency,LocalRelevance,LocalSufficiency,Text
79,817,2,2,2,2,"Radiometric dating can be done in many ways. Today there are over 40 different techniques to do it. It is the fact they are independent, observable, and falsifiable that makes it scientific rigor. I would recommend going tohttp://www.asa3.org/aSA/resources/Wiens.html for more information on radiometric dating."
80,80854,3,2,3,2,"Science can prove that evolution is the beginning of life.

The big bang theory is a term used to describe the bursting of molecules that begun the creation of the universe. The universe started out as a hot, dense space. Scientists know that because now nearby galaxies are moving further and further away and the universe is expanding and becoming cooler, so, in the past, the universe must have been hotter and more dense. Earth was the perfect candidate for life because it has the ""Goldilocks"" conditions. Bacteria started to form from molecules, which formed into fish, and then amphibians, then land animals, then monkeys, then humans."
81,578317615,3,2,3,2,"I call the god that creationists believe in the ""God of the Gaps."" Early man's understanding of the universe was extremely limited. People did not know that earthquakes were caused by tectonic plates shifting. Therefore the idea of earthquakes being the work of an angry deity seemed logical, but man's understanding of the universe has grown significantly. We now know that current species came to be from billions of years of evolution. Supporting creationism is holding humanity back. We need to accept the facts and let religion fade away."
82,79918,2,1,2,1,"its simple, how would we be able to adapt to different enviroments. Over time we adapted to what suited us best otherwise why arn't we one skin colour, why are there so many types of animals"
83,800,3,3,3,2,"Peppered moths is the ULTIMATE straw man.

The peppered moths experiment was a bad experiment and did not show evolution. That how ever doesn't mean that other experiments/observations don't show evolution.

There is loads of evidence to support evolution.

Genes

Fossil record

Carbon dating

Geological data

VIRUS studies

Ohh yeah, viruses.

Do you know how strains of viruses become immune to anti biotic? They evolve, and because viruses reproduce very quickly they evolve over a shorter time period and can be observed by humans.

Your flu injections are made using evolution science."
84,822,2,1,2,1,"Not it's not. But along your line of argument, believe in ""Creationism"" and ""God"" is like believing that a puzzle can be solved by waving a magic wand. I mean, God wouldn't actually touch the pieces with his godly fingers would he?

You clearly don't understand evolution. Read a book or two."
85,823,1,1,2,1,"Why not both? Why can't God have created a way for evolution to happen.

Who says that God did it himself?

Who says that God didn't cause the Big Bang or evolution to occur?

FINAL ANSWER: EVOLUTION THROUGH CREATION"
86,794,3,3,3,2,"You can actually see evolution happen. Fruit Flies are quite useful for this experiment since the breed, live, and die so quickly. You have to understand evolution happens because of mutations and they survive because those mutations have made it easier for the creature to survive then the others. ie. natural selection. Speciation is also an example of evolution... different species come about because they have adapted to a slightly different enviroment. If you look you can see evolution"
87,814,2,2,2,2,Evolution is a science. All the refutes I have seen (which I will rebuttal after this) have nothing to do with science. Their claims are theological claims. Lets first know what science is. Science is known through the scientific method. The scientific method deals only with the natural world. Creationism tries to sneak the supernatural as a scientific explanation. This is called pseudo-science.
88,12580,2,1,2,1,"That's your best argument - ""Because they don't"" ?

I thought there was a reason for everything...

I don't see the squirrel outside my window evolving. In fact, I'm pretty sure squirrels have looked and acted the same for thousands of years.

How does an animal aquire a trait that he wasn't born with? Does he just wish for it really hard and it magically grows?

And you proved my point - ""species have certain characteristics and properties""

I noticed you didn't mention that their characteristics randomly change

And by the way, I'm just wondering because I'm a curious person...

what insects are you talking about?"
89,70855,2,2,3,2,"There has to have been a creator. If you believe in 'The Big Bang', then that's fine. But what caused it? And if it was caused by certain gases reacting with each other, then where did those gases come from? It doesn't matter how you think this universe came to be. The point is that it can't have just appeared. There must have been a creator."
90,12589,2,2,2,1,"That doesn't make much sense. Why are we still evolving and the monkeys aren't?

Why aren't fish jumping out of the water and growing legs?

I mean, if it happened billions of years ago than how come its not happening today?

Why can't we find psuedo-hybrid fish with legs forming?

What caused evolution to stop happening for a mysterious time of thousands of years?"
91,28068,2,1,2,1,"""Debates are based on convincing evidence. There is very little evidence supporting creation, while there are massive amounts supporting an evolutionary argument.""

True. But, evidence must withstand the test of accepted truth. We can't say that creation is false, because there is no explanation provided for the origins of the ""particles"" that caused the evolution theory. Although the evolution theory is interesting, and quite possible, it does not rule out creation. Since creation cannot be ruled out in any way, and evolution can, creation is the best possible theory."
92,71559,2,2,3,2,"I am a nurse and the more I studied biology, the more I was in awe of the miracle of our bodies. Every tiny cell has it's own design that is even more complex than a computer. When you look at a computer do you question that there had to be a creator? Or do you need proof that this highly organized machine came to be about by a mere accident or order of circumstances? Evolutionists need more faith than Creationists."
93,12567,2,2,3,1,"The scientific rigor you mention is not present in evolutionary theory. Here's one example: In the 1800s, Charles Lyell and others came up with dates for the rock strata. Radiometric dating wasn't invented until the 1900s. When it was invented, the techniques were calibrated to match the dates Lyell came up with. To say that this proves the dates that Lyell came up with is a logical fallacy, and it sure doesn't sound like true scientific rigor to me."
94,12592,1,1,2,1,I can prove to you that humans have not evolved since the beginning of recorded history
95,arg33141,1,1,2,1,"I believe its best advancing towards the common good, but it doesn't really exist in this world. Mostly everyone is greedy, selfish, only would care about what they want, and not caring about what others would want. I believe everyone have small feeling towards the common good, but most people think they are important than anyone else in the whole world."
96,arg33099,2,1,2,1,"advancing the common good is better to me because, If i were to pursue my own personal pursuit, it wouldn't be all that good, because most of them would be selfish choices that woulld end up hurting someone else, i dont like hurting people. It would be a much better world if we thought about everyone else well being before we think about our selves."
97,arg33135,2,2,2,2,I think common good is better than personal pursuit because it's always better to assist other people. When people help each other out its more likely that everything comes out great. You get to become a role model by helping some one that needs your help. Yes personal pursuit is important when you are thinking of going to college. But than you got to think about leaving legacy behind by teaching other what you know. So the learning or society process can advance. So therefore you let others take it to the next level.
98,arg33129,2,2,3,2,"I volunteer at Irving Cares, and when I do I feel so great that I can help the community. To me when I help advance the common good I am helping myself. When people do something for the good of others it helps them out in the long run. Whether it is a favor in return or anything else. In a personal pursuit you are just helping yourself. If we all just helped ourselves where would our world be? We all depend on others for help at some point. This world should be about others, not just me."
99,arg33162,3,3,3,3,"This is planet Earth, shared by billions, not just you. If given the opportunity to advance the human race, every person alive should take it; choosing personal gain over advancing the common good is selfish. There's no other way around it. I don't want ot hear ""it's human nature to be selfish"" or any other lame excuse. The point is we all live together, and if your too greedy and self-centered to care about your surroundings and the individuals around you, your merely taking up space."
100,arg33060,2,1,2,1,I think that advancing the common good is better than personal pursuit. The reason for this is that it is better to help others than just to think about yourself. We need to improve our community first before we think about ourselves. If everyone tried to take care of their community then there would be no dangerous places.
101,arg33082,2,1,2,1,"Both endeavors are better to be part of.But I as an individual I would like to advance the common good in this society to become unpetty with each other,to do things way better than they use to.Everyone in this world knows what they want to be. To be alone pursuing their dreams without the help of others, but some other will help the community to make it safe and better.To teach them what they are capable of,to beleive in themselfs that they can do as the things wealthy people does."
102,arg33119,2,1,2,1,"I fell like advancing the common goods is better than personal pursuit because most people will look out for themselves rather than look out for others. Looking out for yourself before lookin out for others won't do alot of good in the long run. I believe in the what goes around comes around thing so when you do something for other people before you try to please yourself, not only does it help them but something good will also come back to you helping you better yourself."
103,arg33089,2,1,2,1,"The ability to do both would be awesome, but since I have to choose I'd rather help others in any way I can. Even a little thing can impact someone's life, like being a friend or helping them with getting their needs to survive life."
104,arg33075,3,2,3,2,"While striving to make advancements for the common good you can change the world forever.

Allot of people have succeded in doing so. Our founding fathers, Thomas Edison, George Washington, Martin Luther King jr, and many more. These people made huge advances for the common good and they are honored for it."
105,arg33070,2,2,3,2,I believe it is more important to have personal pursuit because if you even want to begin to help others you have to help yourself. It's not bad to want to help the common good but if you're always putting other people before yourself you may start to forget about your own needs and wants in life. But I do think that you can have a balance of both.
106,arg33127,2,2,3,2,I think that personal pursuit is more important because in order to help others you have to help yourself first. At the time it may seem selfish but once that you get to a point that you are good at what your doing then you can help others do the same. So not only are you helping yourself but you are also helping others.
107,arg33115,2,2,3,1,"I think i will go with personal persuit because no matter what we do we think of ourself first. I think its the human nature.But personal pursuit does not mean being selfish and only caring about oneself.I need to think about me first,success and then think of others. Everyone does think of themselves before thinking about others. First i need to make me happy to make others happy. This way i can make my life better and be who i am."
108,arg33118,2,1,1,1,"I believe personal pursuit its better, because its your job to decide what you want to do with your life. Your not always going to have someone by your side telling you whats right or wrong. Its all on you of reaching their goals. Its also a good thing to help other reach their succeed their goals."
109,arg33143,1,1,2,1,"I feel that a personal pursuit is a better endeavor. Your personal pursuit should come first before anyone else's. But then again I really don't know, because if someone in your family is in need of something then you're going to do anything help that family member out. I believe that helping someone in your family is just something you do no matter what because they're blood. If someone who you don't know is in need at the same time as someone who is related to you, you're going to help the family member out instead of the random person you don't know."
110,arg33086,2,2,2,2,"A personal pursuit is a better endeavor because you are fulfilling something within yourself. It is important to help others but there is a time to do so. Achieving a personal goal is a journey to fulfillment where one is truly happy. Before helping others you must remember about yourself, but you must not forget about those who are really in need."
111,arg33069,1,1,2,1,"Human nature is to endeavor personal pursuit. If you assume that human nature is to endeavor advancing the common good, then you're going to get screwed by someone who endeavors personal pursuit. Most Americans endeavor advancing the common good; which is why they get screwed by politicians who endeavor personal pursuit. If everyone endeavors personal pursuit, then we would keep each other in check. It is easier to get most people to endeavor personal pursuit than it is to get most people to endeavor advancing the common good; which is why communism failed."
112,arg33126,2,2,2,2,Helping others for the common good can give you a feeling of pride but you have to have the means to be able to help the other person. To have those means you first have to have personal pursuit. I don't think one is better than the other but you first have to have personal pursuit before you can have common good. However for some people their personal pursuit can be the advancement of the common good.
113,arg33105,2,2,2,2,"it is better to help yourself before you can help others. for instance, if you don't have your life together how are you going to help someone else with theirs. if your still living at home with your mother and you don't have a job and one want to help out by giving to an organization you couldn't do it. so basically you have to help yourself before you can help others."
114,arg33123,2,2,2,2,"In order to help advance a common good, you must first realize what is your common good. You have to know when you are that better person to then spread your good to other people. You can't just assume that you are a great person if you don't have anything to show it. If you desire to see a world full of all this goodness, YOU have to be that spark that starts the fire."
115,390,3,3,3,2,"firefox is much better.

It remembers passwords with greater gusto.

add-ons allow you to personalize your browser in every way. I love - tabs (aging and remembering them when you close the browser, weatherfox, gestures,

there is even a tab that lets you display the page in IE format if something is incompatible (rare, only SAP at work)

and the way you can put the link logos in the tool bar rocks.

much friendlier and a better browser, and not just because i don't want to support MS. Because i don't care about that, a good product is a good product."
116,458,2,2,3,2,Mozilla Firefox can be used for everything! There are also plugins so that you can use the internet explorer engine in the firefox shell. It has many more plugins and the themes are a nice feature. all of the innovations in E 7.0 were in firefox years ago.
117,460,2,2,3,2,Firefox takes the best of all previous browsers and sticks it all in one neat package. Security and extendibility are some of its top features. And those times when FF seems to eat up a lot of memory? That's just the cache so you're able to surf the net even faster. Just lower the cache if you don't want to eat so much memory.
118,477,2,2,2,2,"From a design standpoint, Firefox absolutely wins the Pretty Browser battle.

There is such an array of beautiful skins out there for Firefox, and when you add that to the amount of Toolbar and UI customization that Firefox supports, the 'Fox is the clear-cut winner.

And since I assume most of the people debating the superiority of one browser or another are Intraweb junkies, I know everyone uses their browser quite often.

Who wants to look at an ugly UI like that of every IE (7 is the most criminal of them all)?"
119,468,2,2,3,1,Firefox has the user made extensions which cater for the user based community therefore it wins
120,415,1,1,1,1,Really great arguments why IE is supposed to be a better browser... NOT!
121,389,2,1,2,1,Firefox is more respectful of W3C internet standards while  soft sucks by trying to force us to use their own standards to keep their monopoly.
122,76359,1,1,1,1,Firefox of course. And I like this website but I don't find it very clear. This one is better : theworlddebating.com
123,33757,2,2,3,2,"There's no reason at all why anyone could say IE is better. Firefox is proven to be safer, faster, and sleeker. You can customize it to look any way you want, and you can add any functionality you can think of. It even has a more original name!"
124,405,3,2,3,2,"I find that whatever works for a person individually, is good. How would I be able to say something is the best, when, it doesn't work on someone elses computer? I vote for Firefox, because in my experience it has worked multiple times better than Internet Explorer. The config isn't too bad, and those of you who know about:config know what I'm talking about. The tabs are great, and has many good extensions. Though not the best, it is definately superior to Internet Explorer. Especially after the laughable 7 update. ;D"
125,33187,2,1,2,1,"Coming from a casual internet user, I prefer IE because it has a sleeker design, and I find the bookmark/history thing easier. I'm using firefox though, cuz I don't want to transfer my bookmarks again after my brother made it my default browser."
126,12371,2,1,3,1,"I was a IE user from the beginning, but recently I started using Firefox. Apart from the obvious differences like availability of tabs in Firefox which was not avaible in IE I don't find any other significant advantages in using firefox. Also now IE7 has got the tabs feature included, along with add-ons to provide different functionalities.

So I think IE is better than firefox."
127,12367,2,1,3,1,"Firefox (and the extensions) leaks memory like a sieve. An opened session of Firefox 2.0.0.1, three tabs, one week, uses 250  Meg of memory under Task Manager on Windows."
128,65191,1,1,1,1,Well personally I believe Google Chrome is the S*** but Firefox crashes every time I use it.
129,12365,2,1,3,1,"(I am writing this through Firefox) Emotions aside, Firefox has no ActiveX support. It makes it unusable for at least the new wonder tool, Windows VirtualEarth."
130,12388,3,2,3,2,"IE7 on Vista supports protected mode which runs the browser in a security context that has minimal access to your computer and private information. Both Firefox and IE are internet facing apps with occasional security issues, so I prefer the browser with better security architecture."
131,12383,2,2,3,1,I used to be a firefox user but I only have 2GBs of RAM on my system and I like to use more than one program at a time. Firefox sucks up way too much memory to justify the one or two advantages.
132,12380,2,2,3,2,"I'm not an IE user but FFX has a lot of issues

First, it does not start fast when it is loaded from the disk. For my 3 yr old computer, it takes about 10 or more seconds to start it, unlike the browser I use Opera it takes much less time to start.

Plug-ins i frequently use such as Adobe Flash Player does not perfrom well in FFX. The flash movie often stops in FX unlike in Opera which plays flash movies smoothly.

Lastly, Firefox is still young. I guess it is much better than IE. But for me Opera is still the best."
133,65125,1,1,2,1,Chorme beats all its the fastest and the safest plus its also open source like firefox
134,12414,1,1,2,1,"I vote ""Wrong"". It goes against human nature and, as other fellow voters have mentioned, the definition of ""Marriage"".

And you can't exclude religion from this argument, because thats what happened when people don't have faith or belief in any religion. Religion is there to act as guidelines to what is right and what is wrong. Religion is a way of life. Without it, we're lost."
135,12431,1,1,2,1,"I did not propose ""separate but equal."" I proposed ""distinct and different."" Man/woman relationships, especially in the aggregate, have a very different set of implications than man/man and woman/woman relationships. If the law is to contemplate man/woman relationships intelligently, it has to be able to isolate them.

A law requiring separate schools and public accomodations for homosexual people would violate ""separate but equal."" Law defining marriage as a man/woman relationship does not."
136,12466,1,1,1,1,"gays are overrated. it is another ""look at me"" stunt. i think gays are the product of overly protective parents, abuse, or liberal wakoness (it should be a disease).

if you gays would stop calling attention to yourselves, nobody would really care what you do."
137,69708,1,1,1,1,"Of course its wrong.

Why do you think Aids exists?"
138,31527,2,1,2,1,"The Marriage issue should be out of politicians and lawmakers. Marriages are for the Church to decide, Congress have no power to pass a legislation forcing religious institutions about marriage. Maybe, if the courts were to allow gay marriage, it would be alright since it is not a religious institution, it doesn't break the Separation between Church and State ruled by the Supreme Court."
139,42624,1,1,2,1,"An action is ethical if society as a whole would benefit if we all did it. Fair enough?

If everyone had a gay marriage, then society as a whole would NOT benefit. In fact, we would all become extinct, because without one man and one woman there would be no reproduction and continuation of our species.

Therefore, gay marriage can't be ethical.

You can't refute my statement by saying, ""There will always be straight people"" because that's like saying killing someone is right because there will always be those who won't kill."
140,12421,2,1,2,1,"The real issue is - why is the government involved in this issue at all? We take a personal, religious institution and regulate it, then the government comes back and wants to redefine it.

It should not be a political issue, because my personal, religious things should be separate from government regulation.

Marriage and the government should not mix. That solves the ""problem""."
141,12402,2,2,2,1,"From a religious standpoint gay marriage isn't even possible. Let along right. But everyone isn't religious or adheres to specific religious guidance.

Marriage is defined as between a woman and a man. So the word ""marriage"" may be misused in this case. Civil unions, well that's a different matter."
142,76796,2,1,2,1,"Why don't we just get rid of any incentive to be married, politically that is. No tax deductions, no married filing jointly; nothing. Let the churches perform marriages, get the government out completely. If a particular denomination wants to condone homosexuality let them, it's them that are going against their religion.

I don't support it. Like I said, if there were not tax breaks or incentives to be married in the eyes of the state, who cares. My church doesn't support it. It irks me that people who claim to Christians support it and even allow homosexual clergy."
143,12430,1,1,2,1,"If being homosexual was natural then

1. There would only be possibly 6 people on the earth...meaning none of the people making up these sarcastic remakes would be around....heck I wouldn't be around

2. If homosexuality was natural then the butthole would be in the front part of the body.

Its never been accepted as ""natural"" by society only till now. So i'm pretty sure thousands of years of recorded human history have a little more weight than some piss ant liberal venting on how its unfair."
144,530,1,1,2,1,"EVERYONE, regardless of sexual orientation, has the right to be miserable. I say let gay people know the joys of divorce, splitting of assets, custody, alimony, child support, the whole nine yards! In fact, make civil unions illegal; it makes it too easy to ""walk away"" from a relationship and encourages roomates to be ""couples"" to help a buddy out with benefits.Civil Unions, gone, Gay marraige, IN!"
145,73625,2,3,3,3,"Do gay marriages hurt anyone? No. Do gay marriages kill many people? No. Are gay marriages going to end the world? No. Are gay marriages in anyway affecting anyone but the two getting married? No. Then why the hell do straight ppl get so offensive? If you want marrage to just be between you fine let them do something else to show they love each other. Bottom line, if you love someone you should be allowed to be with them. God accepts everyone, his people should follow that. Bottom line, it should be a sin to kep two people who love each other apart. Enough said."
