,arg_id,LocalAcceptability,Cogency,LocalRelevance,LocalSufficiency,Text
0,arg167721,3,2,3,2,"It was undoubtedly Raffles' ambition and vision which led him to search for another British base in the Straits of Malacca, and to select Singapore as the best location to achieve British economic and strategic objectives in the region. Without Raffles, it is likely that Singapore would have remained a sparsely inhabited island, on the margins of the Dutch colonial empire in the East Indies."
1,arg168778,3,2,3,2,"FOUNDER IS NOT A PERSON WHO ""DISCOVERS"" A PLACE if so i can say the prince Sanila Utama is the founder of singapore!(this for some who say farquhar saw the island first) And I do know that farquer has been very involved in this help and sometimes even does all the work but let me remind you that being raffles ""assistant"" he still had to consult raffles and raffles had all authority over Singapore therefore he was given credit. Then i would like to ask u a question why then does the names ""raffles institution"" ""raffles hospital"" raffles medical clinics"""
2,arg168795,2,2,3,2,"Although Farquhar was said to be the one who stayed in Singapore to support its development, Raffles provided the planning, the strategizing, and was the one to select Singapore as another British base, giving early Singapore support of the British. If William Farquhar was to be proclaimed the founder because he did the ""grunt work"", shouldn't the supervisor of a construction site get the most commission, instead of the contractor? And besides, Raffles left Singapore under the orders of his superiors and he did not leave of free will"
3,arg168790,2,1,2,1,He revived the cultural heritage of the region by setting up schools for the Chinese and Malays and did a lot for the people while Farquhar just wanted to gain control through his actions.
4,arg168836,1,1,2,1,"Farquhar has a boss!(raffles) he has to follow raffles and not go about doing anything else if then why cant farquhar help singapore after he was fired? I say again you do need to be in a certain position to be a founder as time, money, effort is all invested. You must know people who would help you."
5,arg580842,1,1,2,1,"Raffles had a vision for Singapore that it will be an orderly, elegant, rational and modern and he worked towards it. And while Raffles was gone, Farquhar developed Singapore poorly causing Raffles to feel dissappointed."
6,arg168803,3,1,2,1,"Raffles conceived a town plan to remodel Singapore into a modern city. The plan consisted of separate areas for different ethnic groups and provision of other facilities such as roads, schools and lands for government buildings. In October 1822, a Town Plan Committee was formed by Raffles to oversee the project."
7,arg168824,3,3,3,3,"Raffles was the person who signed a treaty with the Temenggong and also the Sultan Hussien, and not William Farquhar. I agree that William Farquhar was the one that remained in Singapore to keep it running and also developed it further, but Raffles was the one who gave him the position because he had to leave and return to Bencoolen, also, he was the one who laid out the foundation of Singapore's Development, so he should be considered a founder."
8,arg168771,2,2,2,1,"The Singapore Treaty is signed between Raffles,Sultan Hussein and the Temenggong with Commandant under the accompanying seven ships witnessing the event."
9,arg168835,3,2,3,2,"Even though it is true that Raffles did not work closely with the population to develop Singapore, he provided plans, ideas and was going to put them in action by himself when his superiors ordered him to Bencoolen. Hence it was common sense for Raffles to leave his subordinate to finish his ideas"
10,arg168834,2,2,3,2,"Raffles doesn't care about the citizens, doesn't spare a thought at all.

So what if he discovered the island majulah singapura, he did not help in the least in singapore's development. so why in the world should he deserve the title of 'singapore's founder'?

Farquhar developed the island, with all his ideas contributing to the development."
11,arg168822,2,2,2,2,"Raffles neglected Singapore when he went around conquering other 'more useful' countries for about FOUR years, leaving all the work to Farquhar to settle. Plus, to drive my point further, the countries that were run by Raffles all ended up BADLY. This shows that Raffles was a bad developer of the country."
12,arg168780,2,2,2,2,"Faruhar carried out the 'grand plan' of Raffles'. Raffles practically just sat there and watched it all go, not even lifting a finger to help. It doesn't matter if Raffles was the head of the so-called operation, Farquhar was the one to DEVELOP Singapore to what it is today."
13,arg168804,2,1,2,1,"Faquhar solved the problems in Singapore using cash from his own pocket. When Singapore was once infested with rats and centipedes, Farquhar rewarded the people with coins for every pest they catch. This solved the problem quickly, as he held to his promise."
14,arg168774,3,2,3,2,"Farquhar was the one to implement the actual operations, whereas Raffles only came up with the ideas, which would or would not work. Actions require action, and Farquhar implemented those ideas."
15,arg168830,2,1,2,1,"Raffles came and left Singapore, returning after a long period of time. Farquar stayed here all the time, and solved many problems. Raffles did not do much at all compared to Farquar."
16,arg168807,2,1,2,1,William Farquhar had helped more citizen of Singapore than Raffles did. Raffles was just more of the idea man. William Farquhar was more of a founder of Singapore than Raffles.
17,arg168779,1,1,1,1,Farquhar was unjustly exiled by Raffles even though William had done a lot to help Singapore.
18,arg168818,2,1,2,1,"To me, a founder would be a leader, well respected by the organisation/group he is managing. Both Raffles and Farquhar were good leaders. However, when William Farquhar was sent off to Britain, more people went to send him off than the combined number of people that sent Raffles off during the three times Raffles left Singapore. This shows that the people of Singapore respected Farquhar more than Raffles, and to them, Farquhar was a more competent leader."
19,arg168801,2,1,2,1,"Farquhar contributed significantly, even forking out his own money to start up the colony carved out of the jungle, by first offering money as an incentive for people to hunt and to exterminate rats and centipedes. Raffles did nothing of that sort."
20,arg336563,1,1,2,1,"Yes because that way the child can learn not to do it again because it really hurt, and i know this from experience."
21,arg334884,1,1,2,1,"I believe so, it should be used as a last resort at least because I being a sibling of three, was spanked along with my sister and turned out to be disciplined and on the other hand our youngest sister has never been spanked and she tends to make more mistakes even now that shes 10 than we did."
22,arg335047,1,1,2,1,"Parents should use spanking as an option to discipline only when it's needed. If the child doesn't follow the correct behavior that they should follow after several times being warned, then that is when the child deserves a spanking."
23,arg336222,1,1,2,1,"Humans have been raised for thousands of years with not near as much resentment towards spanking and today's kids are the unruliest there are...

There's a trend...

(I do admit it's not purely spanking that's the cause but it's a small part of the bigger picture)"
24,arg335090,1,1,2,1,Yes I believe you should spank a child only when they know they are wrong. The child will understand more if he is scared to do the same mistake. Actions speak louder than words.
25,arg335089,1,1,2,1,yes because if they fear getting hit than they wont do it again
26,arg334924,1,1,2,1,"because depending on the punishment you give a child it doesn't always work, some kids need need that. because just sitting them in punishment its a possibility they will do it again."
27,arg334959,2,2,3,1,"yea, because even though there are many other different ways to discipline kids, sometimes it won't work so they need a little spank, just to make them learn they were wrong. don't always be spanking them for no reason, that's bad"
28,arg334973,1,1,2,1,"Yes, parents should use spanking as an option to discipline their children, but it should be the last option."
29,arg335097,1,1,2,1,"In my opinion, I strongly agree that parents should use spanking as an option to discipline their children because the spankings are painful enough for children to learn to avoid doing the wrong things."
30,arg335095,2,2,2,2,"Spanking should not be an option to discipline a child, parents have a lot other options before spanking. Its better to talk to them about what they did wrong and solve the problem in a proper way."
31,arg336204,2,2,3,2,"I strongly believe parents should not use physical punishment like spanking to discipline their child. The child will obey if they have a strong healthy relationship with a parent, if they have gained their respect. The parents should have a friendly relationship with their child and the child will soon respect them and agree to what their parents decide although they may not like it. They will learn that the parents know whats best for them."
32,arg335564,3,3,3,2,"Nope. I believe it shouldnt be done just to discipline a child. Parents could just scold their child just so they would stop what they are doing wrong. Hitting is not really a solution because aside hurting a child emotionally, it also hurts them physically. Kids wouldnt learn the value of respect for their parents because they would only learn how to be scared. They wont do the wrong action again next time, not because they've learned their lesson, but because they are just scared that their parents would hit them"
33,arg335129,2,1,2,1,"I don't think anybody would have liked to get spanked by there parents therefore , spanking shouldn't be an Option"
34,arg334934,2,2,3,2,"A parent shouldn't use spanking as an option to discipline a child because they might grow up traumatized and they might feel unloved since they would get spanked a lot, that will cause a low self of esteem. Also spanking shouldn't be an option because at that moment the parent would be full with anger and they wouldn't be thinking logically."
35,arg335091,2,2,2,2,Parents shouldn't use spanking as an option to discipline it just makes the child get mad than to see what they did wrong.
36,arg336179,2,2,2,1,No because hitting your child could mentally scar them for life. also it can make them think hitting their kids is alright.
37,arg334943,2,1,2,1,"No because spanking might effects the relationship between the child and parents. And Children can pick up on the parents attitude acting violent. There are better ways to solve problems, for example using the other techniques."
38,arg334968,2,2,2,2,Physical abuse towards children causes them to fear their parents and may cause a stutter.
39,arg335030,2,1,2,1,"Some kids don't learn by spanking them..So why waste your time on that, when you can always take something valuable away from them."
40,13279,1,1,2,1,"In Nebraska, it's legal to have an abortion by killing the baby while it's coming out of the womb. How can you argue against that?"
41,13275,2,1,2,1,"""The government has no place to tell a woman what she can do with her own body, ever.""

The government DOES have that right.

1) a woman cannot legally prostitute herself in many states

2) a woman cannot take illicit drugs into her own body

3) a woman cannot use her body to murder others

4) a woman cannot use her body to steal

5) a woman cannot display her naked body in public

there are many others. Men can also not do these things.

The government tells us what to do with our bodies ALL THE TIME. This is no different."
42,30319,2,1,2,1,Statistics prove that less than 1% of women who are raped get pregnant because of the adrenalin rush. We have no right to take an unborn child's life. There are ways to avoid the situation of abortion. The woman can have the baby and give it up for adoption or raise it as their own because the woman is the still the child's biological mother. There are thousands of people on the waiting list for another baby to add to their family. DO NOT let anyone tell you otherwise because they obviously havn't been in the situation of adoption or abortion.
43,76937,2,1,2,1,I choose life. Keeping the law pro-choice is allowing women to murder their own unborn human child.
44,75146,2,1,2,1,what we are dealing with is indirect murder if a women decides to abort a child she just had killed a life that may have been a big contribution to society
45,13259,2,1,2,1,"Nobody has the right to tell you what to do with your body, but if that which you are trying to rid off moves away at the first sign of pain, without you feeling it, then ""that"" is no longer yours, since it feels outside your own."
46,70668,2,2,2,2,"There is only one situation in which I believe abortion is okay.

If a mother is incapable of giving birth to the child, and attempting it might kill her, I believe abortion is sad, but necessary.

Otherwise, no one has the right to kill a child, born or unborn."
47,13260,2,2,3,2,"There are tons of ways to not get pregnant. There are condoms (99% effective) for men and women, there are morning-after pills (75% effective), the patch, pill, and other forms of ways not to get pregnant. It's the woman's fault that she didn't do it.

And maybe instead of Pro-choice vs. Pro-life, they (i don't know who ""they"" is) should have pro-life, but with exceptions (i.e. women that get raped) so that it's fair all-around."
48,13270,1,2,2,1,"""If a women is raped"" is a good argument. However why would you punish an innocent baby with the death penalty for some other man's crime. If the women does not want the child she could give it up for adoption. I just dont understand why you would kill the baby, the emotional trauma would happen without the baby as well."
49,54474,2,1,3,2,"A growing embryo is considered human with the heartbeats initiating as early as 21st day of conception. So what if we cannot see the human form, it does have the potential to gain one.

Around 60% of abortions are performed on never married women. Why can't women give the baby up for adoption instead, even if she is raped. If your raped does that give you the right to got out and kill someone?"
50,63512,2,2,3,2,"Here's a story for you from a few years back. A nine year old girl living in poverty in South America was raped by her step dad, and got pregnant with twins. Her family knew that she would die in childbirth, but she was not allowed to get an abortion because they were devout catholics. Both her and her two children died. That's three lives lost. One of those lives actually knew what life was."
51,1661,2,1,2,1,While I personally do not think that abortion is right in any way shape or form. I do not believe the government has the right to make that decision. This is a decision to be made by the parents of the unborn child. NOT the government.
52,74039,2,1,2,1,"You don't know these girl's/women's stories, who are you to judge what they can or can't do? Until you've walked a mile in these girl's/women's shoes, than you may have the opportunity to speak on their behalf. Until then, you may not have to like it and may stand firm with your opinion, but at least have the audacity to respect other's opinions on the subject matter."
53,28415,3,2,3,2,"Giving up a child has to be one of the most responsible decisions a woman can make in her life. Have you any idea the responsibility and maturity it takes to make such an important decision?

If a woman can not support a child(Either emotionally, physically, or financially) she should have right to choose to give up that child."
54,1683,1,1,2,1,"In the United States of America, pro-choice is the only constitutional way to go. Elsewhere in the world, people will do whatever they want."
55,37929,2,2,3,2,"Im going to take the Obama approach to this

Abortion is never something a women would take lightly there will always be a lot of thinking asking for help and even praying involved with making that decision. The pro-life people just don't seam to understand that we also think the abortion is a sad and awful thing and we pro-choicers hope nobody would ever have to make this difficult and life altering situation. there for this decision should be left to the women and not some man miles away in d.c. that has never faced it"
56,1633,2,1,3,1,"If a woman is raped and left with the bastard child of the man who raped her and severely emotionally traumatized her, she should have the decision to give up that baby. Certain circumstances call for desperate decisions and this is one, the choice should be her's to make and she should be allowed to make it."
57,28498,1,1,2,1,"The only other choices are, adoption or keep it.

And I know many children get adopted but many don't

and it might be better off to just have an abortion to

let them suffer.

That's the chance they take, I guess. But who are we to

decide one womans pregnancy."
58,1641,2,2,3,2,"Surely if we are worried about the feelings of unborn children within the first few months of pregnancy, than we should first be worried about protecting the rights of far more conscious animals, such as fully-developed primates.

If its isn't their feelings we are worried about, then I guess I am very confused about the pro-life point of view."
59,69016,2,1,2,1,Who are we to judge what is right or wrong? Can we not just let people make decisions and live with the consequences?
60,arg126375,2,2,3,2,"well, India is finding difficult to manage itself first...so there's no question of leading the world so far....but still if we compare so lets have a look at the following points:

1. almost 90% of India is illiterate(don't be sure of the percentage), so an illiterate country can't lead the world....

2.India is more into castes, politics, religions and less into development.

3.the most important thing is that India doesn't have confidence on itself and is still cursing itself...

So if it goes on so then it is difficult or even impossible to say that ""INDIA WILL LEAD THE WORLD WHEN IT CANNOT LEAD ITSELF!!"""
61,arg145468,2,2,2,2,"All we can say is a big IF because we are not yet 100% sure if this nation itself could lead the whole world. Who knows maybe in the future that India could fail to lead us. There are still other countries who are more progressive, more literated, more powerful than India, like the USA, United Kingdom, Russia, Japan, etc. This nation doesn't have yet enought potentials and ability to sustain the needs of the people. India is not yet that full of technologies like in the Americas. Well in fact technology is one of the most sophisticated and essential inventions ever created."
62,arg122478,2,1,2,1,"i think, the india is not ready to lead the world because of many reasons..

1.) the politians of our country are involved in black money cases. they try to gain or earn money as possible.

2.) they always try to make a big issue of useless topics. e.g., if a politian says something about another politian, they try to make it a big issue ."
63,arg118660,2,2,2,1,"India has the potential to lead because it has the second largest man power n third largest army in the world n it is a country full of hopes n aspirations n for Indians nothing is impossible, n we r proud to be Indians n we will lead the world n be the king of the world in every manner. even 34% scientists in NASA are Indians."
64,arg108959,2,2,2,1,india is is good adopter but a bad developer and leader should be a great developer
65,arg118518,2,1,2,2,"India... where they have like a whole class of opressed people and a huge wealth differences? And with a language that the majority of the world can't understand and doesn't want to understand? India's education quality has nothing compared to Western education and it's the superpowers that control the world's economy.

I highly doubt India will ever lead the world, and it doesn't even have the potential to. It should leave that to the superpowers."
66,arg132199,1,1,2,1,"according to a recent report 50% scientists in NASA are indian IITians, just imagine that if those scientists will join ISRO then our status,value and astronomical knowledge of india will definetly increase.

Now,think abt. IITians,students who are qualifying iit, they are known to be superbrain.If India is capable of opening hitech institutions,then why we are unable provide them a perfect job of their level.we are giving international status of education.then why unable to take best advantages from them.this is due to brain drain,lack of industrial development,suitable working environment as well as proper salary.so its the need of the hour to improve our industrial sector."
67,arg649666,2,1,2,2,"India has Strong Military Neighbors (China & Pakistan)...India has bad relation with Pakistan as they have territorial disputes and also fought 4 wars for this... and as far as china , India relation also become tense with china...due rise of territorial disputes and India interference in Pakistan....as Pakistan China has long term plans ....for example Pak China Economic Corridor and Gawadar Mega Oil City...."
68,arg108968,1,1,1,1,"When the U.S. fought the Brits for their independence, the Brits wore a red uniform. Every time the Americans saw a British soldier, they would yell, ""The red coats are coming, the red coats are coming.""

If India ever tried to take over the U.S., Americans would be forced to yell, ""The red dots are coming, the red dots are coming."" ;)"
69,arg596217,1,1,2,1,"yes,India has potential to lead the world.So, many countries depends on scientists.most of employees in every country is Indians."
70,arg126374,1,1,2,1,"India certainly has d potentials 2 lead d world......

in our real world power and weapons doesn't work any more

maybe...................................

maybe USA,UK or such other contries are more powerful but India is economically more strong.it is d hub 4 many other companies."
71,arg106426,1,1,2,1,"Do we have the potential?

Yes.

The only competition we have is China who has done a much better job for the long run.

But then again the way India runs.. it always makes order out of chaos."
72,arg623493,1,1,2,1,"I am an American, and I am ashamed to admit ""Merica is rich due to slavery. India never had slavery and used to be rich until the British came and took everything away. We were left in a bad state, but started developing quickly. India is much more competitive in education than America and soon when everyone has education (which will happen in our lifetime) India will excel.

India has the potential."
73,arg132483,1,1,1,1,"I already had my say in the debate and we Indians at least managed to learn these mongrel's language and we are pretty good at it. But the rest of you English gimmicks stumble in your own tongue.

I am quoting some sush102

""Hey its better dnt teach me wats da differnce between chatng nd debatng..... If i start my debate na den u bloody will b 4ced to leave dis site nd run away....""

what crap?

""dnt"" , ""ma"" ""dis""

what kind of crap is that???

It makes no difference what you say but it still remains that INDIANS are the BEST!!!!"
74,arg123380,1,1,2,1,India is a secular state.people of all communities reside here so india has the knowledge of almost all countries and the way they live. so it can easily lead all the people of world without creating any nuissance among anyone.
75,arg106091,2,2,3,2,"I believe that India is fast emerging as a hub for international trade and investment. India has provided a huge opportunity to enhance trade and investments in sectors such as mechanical and electrical engineering, food processing, automotive, tourism and banking among others. Almost every multinational company is focusing on India."
76,arg116888,2,2,2,2,"Yes. India does have the potential to lead the world. If the Indian government can look after a country with 28 states of 28 ways, culture, geographical and language, it can certainly can lead the world. For example, there is heavy rainfall in Manipur , while there is water scarcity in Rajasthan. It also has the most wonderful technological developments. Economically also India isn't that low. Eg: Chandrayaan from India discovered water on Moon. What do u say about that? And the father of astronomy, aryabhatta was from India."
77,arg260216,2,1,2,1,"i remember the only country by whose fear alexander's army was afraid

it was INDIA

after just sixty years of independence INDIA is looked as the country to become the sixth member of security council of UN

and it is also the country with a great development rate

And i know that none of us are unknown to the great contribution of INDIA in the discovery of god partical

then from where the matter comes from that INDIA is not having the pottential"
78,arg126378,3,2,3,2,"The Indian economy is galloping at a breakneck speed and might even reach double-digit growth by 2013, feel Finance Minister Pranab Mukherjee and Commerce Minister Anand Sharma. Many economists agree that the demographic dividend that India enjoys could see the country sustain its high growth rate for a long time to come.

The India growth story is indeed enviable. Despite being plagued by myriad problems, India has emerged stronger and more resilient to any global crises so far.

India is expected to be the world's fastest growing economy by 2018, according to Economist Intelligence Unit, a research arm of the Economist magazine."
